{
  "$schema": "https://microspotlight.github.io/openharness-plugins/schemas/plugin-v1.schema.json",
  "schemaVersion": 1,
  "name": "dsh-qqbot",
  "displayName": "DSH QQ Bot",
  "summary": "让 QQ Bot 接入 DeepSeek Harness（dsh）的官方插件",
  "description": "让 QQ Bot 接入 DeepSeek Harness（dsh）的官方插件",
  "version": "0.4.0",
  "publisher": {
    "name": "tencent-connect",
    "url": "https://github.com/tencent-connect"
  },
  "authors": [
    {
      "name": "tencent-connect",
      "url": "https://github.com/tencent-connect"
    }
  ],
  "repository": {
    "type": "git",
    "url": "https://github.com/tencent-connect/dsh-qqbot",
    "issues": "https://github.com/tencent-connect/dsh-qqbot/issues"
  },
  "homepage": "https://github.com/tencent-connect/dsh-qqbot#readme",
  "license": "MIT",
  "distribution": {
    "type": "npm",
    "package": "@tencent-connect/dsh-qqbot"
  },
  "compatibility": {
    "dsh": "0.1.0-rc.6",
    "profiles": [
      "web"
    ],
    "platforms": [
      "web",
      "node",
      "macos",
      "windows",
      "linux"
    ]
  },
  "capabilities": [
    "tool-provider"
  ],
  "categories": [
    "communication",
    "productivity"
  ],
  "keywords": [
    "dsh",
    "qqbot"
  ],
  "permissions": {
    "network": [
      "https://*"
    ],
    "filesystemRead": [],
    "filesystemWrite": [],
    "environment": [],
    "commands": []
  }
}
