{
  "$schema": "https://microspotlight.github.io/openharness-plugins/schemas/plugin-v1.schema.json",
  "schemaVersion": 1,
  "name": "openpets-dsh",
  "displayName": "OpenPets for DSH",
  "summary": "Local first, desktop companion platform with animated pets, plugin SDK and coding-agent integrations.",
  "description": "Local first, desktop companion platform with animated pets, plugin SDK and coding-agent integrations.",
  "version": "3.3.0",
  "publisher": {
    "name": "alvinunreal",
    "url": "https://github.com/alvinunreal"
  },
  "authors": [
    {
      "name": "alvinunreal",
      "url": "https://github.com/alvinunreal"
    }
  ],
  "repository": {
    "type": "git",
    "url": "https://github.com/alvinunreal/openpets",
    "issues": "https://github.com/alvinunreal/openpets/issues"
  },
  "homepage": "https://github.com/alvinunreal/openpets#readme",
  "license": "MIT",
  "distribution": {
    "type": "npm",
    "package": "@open-pets/dsh"
  },
  "compatibility": {
    "dsh": "0.1.0-rc.6",
    "profiles": [
      "web"
    ],
    "platforms": [
      "web",
      "node",
      "macos",
      "windows",
      "linux"
    ]
  },
  "capabilities": [
    "ui-extension"
  ],
  "categories": [
    "productivity",
    "web"
  ],
  "keywords": [
    "dsh",
    "openpets"
  ],
  "permissions": {
    "network": [],
    "filesystemRead": [],
    "filesystemWrite": [],
    "environment": [],
    "commands": []
  }
}
