{
  "$schema": "https://microspotlight.github.io/openharness-plugins/schemas/plugin-v1.schema.json",
  "schemaVersion": 1,
  "name": "dshrb-bundle",
  "displayName": "Bundle",
  "summary": "DSH bundle: installs DSH Reviewer Bot into a profile with `dsh plugin --profile <name> add`.",
  "description": "DSH bundle: installs DSH Reviewer Bot into a profile with `dsh plugin --profile <name> add`.",
  "version": "0.1.5",
  "publisher": {
    "name": "chaojixinren",
    "url": "https://github.com/chaojixinren"
  },
  "authors": [
    {
      "name": "chaojixinren",
      "url": "https://github.com/chaojixinren"
    }
  ],
  "repository": {
    "type": "git",
    "url": "https://github.com/chaojixinren/dsh-reviewer-bot",
    "issues": "https://github.com/chaojixinren/dsh-reviewer-bot/issues"
  },
  "homepage": "https://github.com/chaojixinren/dsh-reviewer-bot#readme",
  "license": "MIT",
  "distribution": {
    "type": "npm",
    "package": "@dshrb/bundle"
  },
  "compatibility": {
    "dsh": "0.1.0-rc.6",
    "profiles": [
      "web"
    ],
    "platforms": [
      "web",
      "node",
      "macos",
      "windows",
      "linux"
    ]
  },
  "capabilities": [
    "tool-provider"
  ],
  "categories": [
    "communication",
    "productivity"
  ],
  "keywords": [
    "dsh",
    "dshrb",
    "bundle"
  ],
  "permissions": {
    "network": [],
    "filesystemRead": [
      "~/.dsh"
    ],
    "filesystemWrite": [
      "~/.dsh"
    ],
    "environment": [],
    "commands": []
  }
}
