{
  "$schema": "https://microspotlight.github.io/openharness-plugins/schemas/plugin-v1.schema.json",
  "schemaVersion": 1,
  "name": "dsh-ssh",
  "displayName": "DSH SSH",
  "summary": "Remote SSH operations for the dsh web GUI: host config store (~/.dsh/dsh-ssh.json, import from ~/.ssh/config), a persistent ssh2 connection pool with jump-host support, exec / PTY web terminal / SF...",
  "description": "Remote SSH operations for the dsh web GUI: host config store (~/.dsh/dsh-ssh.json, import from ~/.ssh/config), a persistent ssh2 connection pool with jump-host support, exec / PTY web terminal / SFTP transfer / local port-forward tunnels / cluster execution, plus agent tools (ssh_list, ssh_exec, ssh_upload, ssh_download, ssh_tunnel, ssh_cluster). Hot-pluggable — mounted via ~/.dsh/cordis.patch.yml + a profile node_modules symlink, no dsh source changes.",
  "version": "0.2.7",
  "publisher": {
    "name": "CAPTAIN1275",
    "url": "https://github.com/CAPTAIN1275"
  },
  "authors": [
    {
      "name": "CAPTAIN1275",
      "url": "https://github.com/CAPTAIN1275"
    }
  ],
  "repository": {
    "type": "git",
    "url": "https://github.com/CAPTAIN1275/dsh-ui-web",
    "issues": "https://github.com/CAPTAIN1275/dsh-ui-web/issues"
  },
  "homepage": "https://github.com/CAPTAIN1275/dsh-ui-web#readme",
  "license": "Apache-2.0",
  "distribution": {
    "type": "npm",
    "package": "@captain1275/dsh-ssh"
  },
  "compatibility": {
    "dsh": "0.1.0-rc.6",
    "profiles": [
      "web"
    ],
    "platforms": [
      "web",
      "node",
      "macos",
      "windows",
      "linux"
    ]
  },
  "capabilities": [
    "ui-extension",
    "tool-provider"
  ],
  "categories": [
    "ai",
    "web"
  ],
  "keywords": [
    "dsh",
    "ssh"
  ],
  "permissions": {
    "network": [
      "https://*"
    ],
    "filesystemRead": [
      "workspace",
      "~/.dsh"
    ],
    "filesystemWrite": [
      "workspace",
      "~/.dsh"
    ],
    "environment": [],
    "commands": [
      "bash",
      "sh",
      "ssh"
    ]
  }
}
