{
  "$schema": "https://microspotlight.github.io/openharness-plugins/schemas/plugin-v1.schema.json",
  "schemaVersion": 1,
  "name": "dsh-client-ui-web-ui-settings",
  "displayName": "DSH Client UI Web UI Settings",
  "summary": "Web UI plugin group for the dsh settings page: one card that hosts the dsh-web-ui family plugins' enable switches and configuration forms.",
  "description": "Web UI plugin group for the dsh settings page: one card that hosts the dsh-web-ui family plugins' enable switches and configuration forms.",
  "version": "0.2.7",
  "publisher": {
    "name": "CAPTAIN1275",
    "url": "https://github.com/CAPTAIN1275"
  },
  "authors": [
    {
      "name": "CAPTAIN1275",
      "url": "https://github.com/CAPTAIN1275"
    }
  ],
  "repository": {
    "type": "git",
    "url": "https://github.com/CAPTAIN1275/dsh-ui-web",
    "issues": "https://github.com/CAPTAIN1275/dsh-ui-web/issues"
  },
  "homepage": "https://github.com/CAPTAIN1275/dsh-ui-web#readme",
  "license": "Apache-2.0",
  "distribution": {
    "type": "npm",
    "package": "@captain1275/dsh-client-ui-web-ui-settings"
  },
  "compatibility": {
    "dsh": "0.1.0-rc.6",
    "profiles": [
      "web"
    ],
    "platforms": [
      "web",
      "node",
      "macos",
      "windows",
      "linux"
    ]
  },
  "capabilities": [
    "ui-extension"
  ],
  "categories": [
    "web",
    "productivity"
  ],
  "keywords": [
    "dsh",
    "client",
    "ui",
    "web",
    "settings"
  ],
  "permissions": {
    "network": [],
    "filesystemRead": [
      "~/.dsh"
    ],
    "filesystemWrite": [
      "~/.dsh"
    ],
    "environment": [],
    "commands": []
  }
}
