{
  "$schema": "https://microspotlight.github.io/openharness-plugins/schemas/plugin-v1.schema.json",
  "schemaVersion": 1,
  "name": "seektty",
  "displayName": "Seektty",
  "summary": "SeekTTY, a pluggable DeepSeek-colored terminal surface for DeepSeek Harness",
  "description": "SeekTTY, a pluggable DeepSeek-colored terminal surface for DeepSeek Harness",
  "version": "1.0.0",
  "publisher": {
    "name": "Hilbert-beinghappy",
    "url": "https://github.com/Hilbert-beinghappy"
  },
  "authors": [
    {
      "name": "Hilbert-beinghappy",
      "url": "https://github.com/Hilbert-beinghappy"
    }
  ],
  "repository": {
    "type": "git",
    "url": "https://github.com/Hilbert-beinghappy/seektty",
    "issues": "https://github.com/Hilbert-beinghappy/seektty/issues"
  },
  "homepage": "https://github.com/Hilbert-beinghappy/seektty#readme",
  "license": "MIT",
  "distribution": {
    "type": "git",
    "package": "seektty",
    "url": "https://github.com/Hilbert-beinghappy/seektty.git",
    "ref": "f40fb3ea2e7cb572ed25af727d347844b7e72446"
  },
  "compatibility": {
    "dsh": "0.1.0-rc.6",
    "profiles": [
      "web"
    ],
    "platforms": [
      "web",
      "node",
      "macos",
      "windows",
      "linux"
    ]
  },
  "capabilities": [
    "tool-provider"
  ],
  "categories": [
    "developer-tools",
    "productivity"
  ],
  "keywords": [
    "dsh",
    "seektty"
  ],
  "permissions": {
    "network": [],
    "filesystemRead": [],
    "filesystemWrite": [],
    "environment": [],
    "commands": [
      "bash",
      "sh"
    ]
  }
}
